{
  "return_id":"R1","trigger":"Verified earlier primary evidence changes Q1's chronology premise.","trigger_object":"evidence:E7","from_state":"ARGUMENT","target_state":"QUESTION","target_object":"question:Q1","target_skill":"formulating-research-question","reason":"Q1 assumes origination after the transition; E7 documents an earlier instance.","new_evidence":["E7"],"new_interpretation":[],"invalidated_gates":[{"gate":"Argument gate A1","previous_status":"PASS","validity":"INVALIDATED","dependency_refs":["Q1","E7"]}],"preserved_gates":[{"gate":"Source identity gate S1","previous_status":"PASS","validity":"VALID","dependency_refs":["S1"]}],"artifacts_to_reopen":["Q1","A1"],"researcher_decision_required":true,"return_status":"APPROVED","authorized_by":"researcher:R1","authorization_ref":"approval:example:R1","proposal_digest":"sha256:3333333333333333333333333333333333333333333333333333333333333333"
}
